Business,Address,City,State,phurl,Types,Alcohol,Wifi,Score,Price,Hours,Phone,URL,Main,Frugal,Wine,Gluten-Free,Caffeine,Vegetarian,Carnivore,Beer,Cocktails,Healthy,Family,Fresh,Dessert,Spicy,Late-Night,Service,Seafood,FastHoagie Haven,242 Nassau St.,Princeton ,NJ,http://media-cdn.pinterest.com/upload/17592254763894955_HZEaOu1m.jpg,"Sandwiches, Late-Night, Lunch",No,No,0.8,5,M-Su 11:00am-12:00am,(609) 921-7723,hoagiehaven.com,Hoagie Haven is very popular among the Princeton students. It's a late-night hangout for people after having a few drinks. It can be a little chaotic inside. Be sure to stand to the right to place your order.,"Everything at Hoagie Haven is fairly inexpensive. You can get a half version of any sandwich for less than $5. The big sandwiches can be up to $10, but you can easily split them with a friend.",,,"Hoagie Haven has an enormous selection of sodas, energy drinks, and canned teas / coffee. At least one of these is sure to perk you up.",The omelets are great alternatives to the meat-heavy dishes for vegetarians.,,,,,,There's almost nothing here that's fresh. The only think you get is delicious hoagies,,"Get extra hot sauce, jalapenos peppers, and banana peppers on ALL the hoagies you get. Also, if you're getting the Dirty Sanchez, get the extra dirty sanchez","After you've had your drinks at Ivy or at an eating club, be sure to stop by the Haven. Order off the black menu! If you order something that appears to be too healthy, you might get a weird look from the employees.",,,George's Roasters and Ribs,244 Nassau St.,Princeton,NJ,http://www.princetonsrestaurants.com/www.princetonsrestaurants.com/images/large/georges-roasters-princeton-367x351.jpg,"Sandwiches, Late-Night, Lunch, Wings",No,No,0.7,5,"M-S 9:00am-11:00pm, Su 12:00-8:00pm",(609) 252-0419,georgesprinceton.com,"George's is just down the block from Hoagie Haven and very similar. Owned by the same people, they also sell subs and other late-night delights. ",,,,,,,,,,,,,,,,,Tortuga's,41 Leigh Avenue,Princeton,NJ,https://irs0.4sqi.net/img/general/original/0bNIPjUQCyicDdYH9lBCnmETgpkXyJ6yCFAz8EPTwO0.jpg,"Mexican, Lunch, Dinner",No,No,0.75,20,"M-T 11:30am-9:30pm, F 11:30am-10:00pm, S 5:00pm-10:00pm, Su 5:00pm-9:00pm",(609) 924-5143,tortugasmv.com,,,,,,,,,,,,,,,,,,Fruity Yogurt,166 Nassau St.,Princeton,NJ,http://oksanathefoodie.files.wordpress.com/2012/07/fruity-yoghurt.png?w=500&h=380,"Ice Cream, Dessert",No,No,0.75,6,,(609) 921-8787,,A bright and friendly atmosphere with a unique selection of desserts including froyo and bubble tea. Known for their taro flavor. Good for meetings and hangouts.,"Froyo is priced by the ounce, including any fresh toppings you choose to sprinkle on top. Bubble tea has good value. Credit cards only accepted for charges over $5.",,,,,,,,Froyo is advertised to be a healthy alternative to ice cream. Bubble tea is highly sweetened.,,Fresh fruits offered as selections for toppings on froyo. Bubble tea is not made fresh.,"A good place for dessert, enough to satisfy any sweet tooth.",,,,,Qdoba,140 Nassau St.,Princeton,NJ,http://is0.4sqi.net/userpix/N3ZR4WAGF0ZJY3XV.jpg,"Mexican, Lunch, Dinner, Fast-Food",No,No,0.75,8,"M-Th 10:30am-11:00pm, F-S 10:30am-12:00am, S 10:30am-11:00pm",(609) 921-2031,qdoba.com,,A good amount of food for the price. Guacamole always costs extra. Rewards system gives a free meal for every 10 entrees.,,,,,,,,,,Ingredients are generally fresh or freshly made.,,"Entrees come with a variety of choices for spicy salsa, with different levels of spiciness. Tobasco and cholula hot sauce are both provided on the side.",,,,The Bent Spoon,35 Palmer Square W,Princeton,NJ,http://www.foodgps.com/wp-content/uploads/2008/06/p6060046.jpg,"Ice Cream, Dessert",No,No,0.8,8,,(609) 924-2368,thebentspoon.net,,,,,,,,,,,,,,,,,,Naked Pizza,180 Nassau St.,Princeton,NJ,http://farm8.staticflickr.com/7031/6553207307_6548cfa539_z.jpg,"Pizza, Lunch, Dinner",No,No,0.6,15,"M-Th 11:00am-10:00pm, F 11:00am-2:00am, S 9:00am-2:00am, Su 11:00am-10:00pm",(609) 771-6100,nakedpizza.biz,,,,,,,,,,,,,,,,,,Panera Bread,136 Nassau St.,Princeton,NJ,http://photos.igougo.com/images/p61254-Princeton-Panera_Bread_Co._Princeton.jpg,"Sandwiches, Coffee, Pastries, Lunch, Dinner",No,Yes,0.5,8,"M-F 9:00am-9:00pm, S-Su 10:00am-9:00pm",(609) 683-3896,,,,,,,,,,,,,,,,,,,Starbucks,100 Nassau St.,Princeton,NJ,http://www.starbucks.com/static/images/global/logo.png,"Coffee, Pastries",No,Yes,0.65,5,M-Su 5:30am-12:30 am,(609) 279-9204,starbucks.com,One of the fancier starbucks right across the street from Princeton University. They have a clover-leaf machine to get fresh ground coffee. ,,,,,,,,,,,,,,,,,Olives,22 Witherspoon St.,Princeton,NJ,http://www.princetonsrestaurants.com/www.princetonsrestaurants.com/images/large/olives-gourmet-bakery-367x334.jpg,"Lunch, Dinner, Sandwiches, Greek",No,No,0.75,12,,(609) 921-1569,olivesprinceton.com,"Located right on Witherspoon St., Olives has a great lunch selection. They have dozens of different fresh salads as well as a row of fresh made food. Their #chickencurry is one of their more popular dishes. ",,,,,,,,,,,,,,,,,Small World Coffee,14 Witherspoon St.,Princeton,NJ,http://b.vimeocdn.com/ts/819/175/8191757_640.jpg,"Coffee, Pastries",No,Yes,0.8,5,"M-S 6:30am-6:00pm, Su 7:30am-5:00pm",(609) 924-4377,smallworldcoffee.com,"Popular local coffee shop in Princeton. Located right on Nassau street, it's a great place to grab a cup of coffee. ",,,,,,,,,,,,,,,,,Thomas Sweet,179 Nassau St.,Princeton,NJ,http://tkgo.files.wordpress.com/2009/12/large_img_2880.jpg,"Ice Cream, Dessert",No,No,0.83,8,"M-Th 11:00am-11:00pm, F 11:00am-12:00am, Su 11:00am-11:00pm",(609) 683-8720,thomassweet.com,"A popular student hangout ice-cream shop located near the campus of Princeton University. Thomas Sweet's is a classic Princeton establishment, having served the likes of Albert Einstein. They have a variety of ingredients to mix into your ice cream delight from heath bar to graham crackers. ",It's not the cheapest place for people who want dessert. The smaller cups are usually around $4 and don't have a lot of food. It's best to get a larger cup for around $6 and share if you're trying to save,,,,,,,,,,,,,,,,Mehek,164 Nassaus St.,Princeton,NJ,http://images.citysearch.net/assets/imgdb/merchant/2012/7/24/0/hnvKzRlO107.jpeg,"Lunch, Dinner",No,No,0.75,15,M-Su 11:00am-10:00pm,(609) 279-9191,meheknj.com,"A pricier but authentic Indian restaurant. A nice, warm atmosphere inside, with friendly staff. Provides take-out and catering with online or phone reservation. The #naan is fresh and amazing.","Dishes are small and slightly expensive, but food is authentic and of good quality.",,,,"A variety of vegetarian dishes available, with a diverse selection and authentic taste. Try getting the #Sagwala. ",,,,,,,,Dishes can be made to different levels of spiciness. Spices used vary but generally complement the dishes.,,,,Thai Village,235 Nassau St.,Princeton,NJ,http://www.princetonsrestaurants.com/www.princetonsrestaurants.com/images/large/thai-village-princeton-nj-372x509.jpg,"Thai, Lunch, Dinner",No,No,0.75,15,,(609) 683-3896,,"A lone Thai place, run by Chinese owners, with good but unauthentic food. A good environment for group or family meals.","Lunch special is priced well and comes with a soup, salad, or spring roll.",,,,,,,,,,,"Provides a small selection of desserts, including mango sticky rice.","Dishes can range from mild to spicy, though spice is often added arbitrarily, without complementing the taste.",,,,Tomo Sushi,236 Nassau St.,Princeton,NJ,http://www.andychendesign.com/blog/tomo.jpg,"Japanese, Lunch, Dinner",No,No,0.8,12,,(609) 924-8897,princetontomosushi.com,"Very small restaurant run by Chinese owners, serving sushi and other Japanese dishes. Very generic and unauthentic, but quick and decently priced.",Lunch special is very well priced and comes with soup and salad.,,,,,,,,,,"Sushi is made with fresh ingredients, and seafood is of decent quality.",,,,,,Subway,18 Witherspoon St.,Princeton,NJ,http://planetprinceton.com/wp-content/uploads/2012/05/IMG_3094.jpg,"Sandwiches, Fast Food",No,No,0.625,8,"M-F 7:00am-9:30pm, S 8:00am-9:30pm, Su 8:00am-8:00pm",(609) 924-5063,subway.com,,,,,,,,,,,,,,,,,,Pjs Pancake House,154 Nassau St.,Princeton,NJ,http://s3-media2.ak.yelpcdn.com/bphoto/fW3ZYVMuaS7obxf-f-W73g/l.jpg,"Diner, Breakfast, Lunch, Dinner",No,No,0.5,15,"M-Th 7:00am-10:00pm, F-S 7:00am-12:00am, Su 7:00am-10:00pm",(609) 924-1353,pancakes.com,,,,,,,,,,,,,,,,,,Osteria Procaccini,4428 Rt 27 N,Kingston,NJ,http://graphics8.nytimes.com/images/2012/03/04/nyregion/04DINENJ2_SPAN/04DINENJ2_SPAN-articleLarge.jpg,"Pizza, Lunch, Dinner",No,No,0.75,20,"M closed, T-Th 11:30am-9:00pm, F-S 11:30am-10:00pm, Su 4:00pm-9:00pm",(609) 688-0007,osteriaprocaccini.com/,,,,,,,,,,,,,,,,,,Triumph,138 Nassau St,Princeton,NJ,http://idrunkthat.com/wp-content/uploads/2010/02/Triumph_Brewing_New_Hope_011.jpg,"Brewery, Lunch, Dinner",Yes,No,0.8,32,"M-S 11:30am - 10:00pm, Su 12:00pm-10:00pm",(609) 924-7855,triumphbrewing.com,,,,,,,,,,,,,,,,,,Tiger Noodles,260 Nassau St,Princeton,NJ,http://staticart.yellowbook.com/adartwork/PaidAds/000/017/262/75.1.gif,"Chinese, Lunch, Dinner",No,No,0.7,8,M-Su 11:30am-10:00pm,(609) 252-0663,,"A generic chinese restaurant, run-of-the-mill in everything from taste to price.","Lunch special is well-priced, with a suitable amount of food.",,,,,,,,,,,,,,,,Hunan Chinese Restaurant,157 Witherspoon,Princeton,NJ,http://www.menupix.com/town_cuisine_img/HunanCCC.jpg,"Chinese, Lunch, Dinner",No,No,0.7,10,,(609) 921-6950,,,,,,,,,,,,,,,,,,,Cheeburger Cheeburger,,Princeton,NJ,http://cheeburger.com/home2/cheeBurger.jpg,"American, Burgers",No,No,0.7,10,,,cheeburger.com,,,,,,,,,,,,,,,,,,Halo Pub,9 Hulfish St,Princeton,NJ,http://3.bp.blogspot.com/-CSJpjGdG_48/TbSUX4oym1I/AAAAAAAALeA/DJo_C2TGqTo/s1600/IMG_2843.JPG,"Ice Cream, Dessert",No,No,0.7,8,,(609) 921-1710,,`,,,,,,,,,,,,A wide selection of good ice cream flavors to satisfy any craving.,,,,,Wawa,140 University Pl,Princeton,NJ,https://is1.4sqi.net/derived_pix/fFL2QRKbbhrD5B6cmH4s1AtG9snoFpKdHsj1pPe_8Eo_300x300.jpg,"Sandwiches, Coffee",No,No,0.6,5,M-Su 12:00am-11:59pm,(609) 921-3677,wawa.com,Overpriced but conveniently-located all-in-one food and snack shop with a selection of hot and cold foods.,,,,,,,,,,,A small selection of fresh fruits. Sandwiches are typically made with fresh ingredients.,"A small selection of smoothies, desserts, and baked goods. Generally overly sweetened and generic.",,,,,